{
  "id": "grant-demo-001",
  "intent_id": "intent-demo-001",
  "bound_payload_sha256": "3333333333333333333333333333333333333333333333333333333333333333",
  "profile_revision": 2,
  "packet_sha256": "1111111111111111111111111111111111111111111111111111111111111111",
  "form_schema_sha256": "2222222222222222222222222222222222222222222222222222222222222222",
  "destination_origin": "https://employer.example.invalid",
  "operation": "submit",
  "nonce": "fixture-only-not-a-real-secret-0001",
  "issued_at": "2026-09-25T10:01:00Z",
  "expires_at": "2026-09-25T10:06:00Z",
  "explicit_user_gesture": true,
  "consumed_at": null
}